1,"William H. Rehnquist  Very well, Mr. Kneedler.  Ms. Dahl, we'll hear from you.     Christine S. Dahl  --Yes, Your Honor.  I was drawing a comparison between the situation with Mr. Zadvydas and Mr. Martinez.  Detention, of course, needs to be reasonably related to its purpose.  Here removal cannot be achieved.  So detention for that purpose becomes arbitrary and punitive, and we'd ask the Court to affirm the grant of habeas corpus and Mr. Martinez's release on supervision conditions.   William H. Rehnquist  Thank you, Ms. Dahl.  Mr. Mills, we'll hear from you.     John S. Mills  Mr. Chief Justice, and may it please the Court:  I think that we have lost sight of the statutory scheme that applies here.  Section 1182(d)(5)(A) is not a detention statute.  It's clearly not preserved as an initial matter.  It was not in the answer to either habeas petition.  The justification given in the district court in both cases was 1231(a)(6).  But, Justice Breyer, there is no need to remand this case because a clear, simple reading of the immigration statutes demonstrates that 1182 is not a detention statute.  You have to go through the process, and I attempted to do this in my reply brief, but I think I can do it a little bit more clearly for the Court this morning.  When an alien first arrives, he's an applicant for admission.  Section 1225(b)(2)(A) of title 8, United States Code says an applicant for admission... any applicant for admission shall be detained until the removal proceeding unless it is clear, beyond any doubt, that they are entitled to come in.  So all aliens, when they apply... that's the detention statute that initially applies, 1225(b)(2)(A).  They are to be detained until there is a removal proceeding.  The removal proceeding, which is governed by 1229(a)(1)... I'm sorry... 1226(a)... it is 1229(a)... is to determine whether the alien is admissible or not, whether they should come in or whether they must be removed.  So 1225(b)(2)(A) says detain until that point.  1182(d)(5)(A) then comes in to authorize the Government to stop that process for humanitarian reasons and parole an alien in.  We won't have the removal process.  We're going to... we... we're going to get out of the detention in 1225(b)(2)(A), and we're going to let you out on parole, which is discretionary.  That's 1182(d)(5)(A).  If at any time, we in our discretion think it is no longer appropriate to keep you on parole, we can revoke that parole, and the statute 1182(d)(5)(A) says once parole is revoked, the alien is treated as, quote, any other applicant for admission.  So you go back to 1225(b)(2)(A), which says detain them until the removal proceeding.   William H. Rehnquist  Well, you... you might wait a while if you went to the United Nations or--  [Laughter]  --or to... I take it the Government feels you need some sort of a rather immediate recourse.   John S. Mills  --Sure, and our Government has demonstrated that it believes in preemptive... preemptive action and we can go in and have regime change in Cuba if it... if it is such a threat.  If it's a political decision, the purely executive decision, that our national security is so threatened, they have all kinds of tools.   William H. Rehnquist  How do you explain, Mr. Mills, the language that the Court used, pointing out how different this kind of a case would have been from the... from the Zadvydas case?   John S. Mills  --Sure.  My reading of that... of that decision, there were two parts of the decision.  There was part one, which examined whether there is a... or it determined whether the statute is ambiguous, and part two is whether there's a constitutional error.  It was only in the part of the decision deciding whether there's a constitutional problem that the distinction was made.  The distinction makes the difference in whether there's a problem or not.  And maybe there's not a problem for inadmissible aliens.  So, the Court then concluded in Zadvydas that because there's a problem, we look at the statute.  This statute could be interpreted to authorize indefinite detention or not.  It's ambiguous.  Because we have a problem, at least with one category, we're going to choose the... a safe route.   William H. Rehnquist  Thank you, Mr. Mills.  Mr. Kneedler, you have 4 minutes remaining.     INTERRUPTING ",03-878X
0,"William H. Rehnquist  Well, how do you explain then, Ms. Dahl, the language in the Court's Zadvydas opinion that had, were we dealing with, in effect, off-shore aliens, this would be a much different case?   INTERRUPTING William H. Rehnquist  So you say that a person, even though they're not lawfully admitted into the United States, still couldn't be indefinitely detained.   INTERRUPTING William H. Rehnquist  Well, the Government distinguishes that case.  What do you make of their distinction?   William H. Rehnquist  But are... are the people here charged with any sort of terrorist activities?  They were committed... convicted of crimes, but I... I didn't think they were connected with terrorist activities.   INTERRUPTING William H. Rehnquist  Yes.   William H. Rehnquist  Well, except that with aliens, they can be deported, whereas a citizen can't be, upon release from prison.   INTERRUPTING ",03-878X
0,"William H. Rehnquist  In Mistretta it might have come out the other way had it not been for that observation.   William H. Rehnquist  I'm assuming that in the case of, say, perjury at trial, you couldn't possibly allege that in the indictment because you won't know.   William H. Rehnquist  Well, what if this Court said the guidelines are unconstitutional, period, and then judges simply looked to the guidelines, figuring, well, this is as good an idea as anybody else has about sentencing?  [Laughter]   INTERRUPTING ",04-104X
1,"William H. Rehnquist  Well, whoa.  What if, what if the statute says  ""every felony in this state shall be punished by a term of not less than one year, or, on the other side, life. ""  and you're committed to the parole authority, and the parole authority will decide between those boundaries?   William H. Rehnquist  How about the form of verdict under your system?  Is there one line for the basic offense, and then other lines for each additional factor that's alleged in the indictment?   INTERRUPTING William H. Rehnquist  But you're suggesting, then, a special... a special verdict in every case where there are guideline facts to be found.   William H. Rehnquist  Thank you, Mr. Kelly.  Ms. Scapicchio.     William H. Rehnquist  Conspiracy to what?   William H. Rehnquist  Did the trial judge give any indication of what sentence he would have imposed if he were not constrained by the guidelines?   William H. Rehnquist  You wouldn't sever out the ones that would permit a downward departure, would you?   INTERRUPTING William H. Rehnquist  You would leave in place the provisions for downward departures?   William H. Rehnquist  Well, and... but could you answer my question?   INTERRUPTING William H. Rehnquist  Would you leave in place the provisions for downward departure?   William H. Rehnquist  But would it... would it really save the guidelines in the way that Congress intended them, to strike basically the provision for enhancements, and leaving in place the provisions for downward departures?   William H. Rehnquist  Well, but will there be proportionality if the sentences, sentences can be downward, the jury verdict could be adjusted downward, but not upward?   William H. Rehnquist  But you can say the same thing if we simply said that the whole guidelines fall, and they're simply there for judges to apply if they wish.  You can say,  ""Well, if Congress doesn't like that they can come in and put a new system. ""  That's true any time Congress acts.   ",04-104X
1,"William H. Rehnquist  In Mistretta it might have come out the other way had it not been for that observation.   William H. Rehnquist  I'm assuming that in the case of, say, perjury at trial, you couldn't possibly allege that in the indictment because you won't know.   William H. Rehnquist  Well, what if this Court said the guidelines are unconstitutional, period, and then judges simply looked to the guidelines, figuring, well, this is as good an idea as anybody else has about sentencing?  [Laughter]   INTERRUPTING ",04-104X
0,"William H. Rehnquist  Well, whoa.  What if, what if the statute says  ""every felony in this state shall be punished by a term of not less than one year, or, on the other side, life. ""  and you're committed to the parole authority, and the parole authority will decide between those boundaries?   William H. Rehnquist  How about the form of verdict under your system?  Is there one line for the basic offense, and then other lines for each additional factor that's alleged in the indictment?   INTERRUPTING William H. Rehnquist  But you're suggesting, then, a special... a special verdict in every case where there are guideline facts to be found.   William H. Rehnquist  Thank you, Mr. Kelly.  Ms. Scapicchio.     William H. Rehnquist  Conspiracy to what?   William H. Rehnquist  Did the trial judge give any indication of what sentence he would have imposed if he were not constrained by the guidelines?   William H. Rehnquist  You wouldn't sever out the ones that would permit a downward departure, would you?   INTERRUPTING William H. Rehnquist  You would leave in place the provisions for downward departures?   William H. Rehnquist  Well, and... but could you answer my question?   INTERRUPTING William H. Rehnquist  Would you leave in place the provisions for downward departure?   William H. Rehnquist  But would it... would it really save the guidelines in the way that Congress intended them, to strike basically the provision for enhancements, and leaving in place the provisions for downward departures?   William H. Rehnquist  Well, but will there be proportionality if the sentences, sentences can be downward, the jury verdict could be adjusted downward, but not upward?   William H. Rehnquist  But you can say the same thing if we simply said that the whole guidelines fall, and they're simply there for judges to apply if they wish.  You can say,  ""Well, if Congress doesn't like that they can come in and put a new system. ""  That's true any time Congress acts.   ",04-104X
1,"William H. Rehnquist  Very well, Mr. Browning.  Mr. Hurt, we'll hear... we'll hear from you.     Mark T. Hurt  I think that... that that is a possible case, but I think that that's... the priorities for the Government and... and Congress in drafting this law was to get money back for the Government.  That's their number one concern here and to incentivize that whistleblower.  If it so happens that the whistleblower takes much... takes a long time to prepare his qui tam and brings his... his retaliation action at the same time and ends up getting some more damages, I... I think that ranks low on the list of Congress'priorities in drafting this retaliation provision.  It's the... getting the Government's money back, giving the whistleblower protection and an incentive to bring that qui tam claim is really Congress'core concern here.  And I think these other issues about damages mounting can be readily addressed with the mitigation defense and... and dealing with that that will take care of double damages so... so if the whistleblower is just sitting around waiting for that, then the mitigation defense would take care of that.  Also, I think the petitioner raised the idea that this is some kind of... the... the retaliator can bring some kind of nebulous fraud allegation if it doesn't... isn't really tied to a specific false claim.  I think that the courts are not interpreting it that way because this is a False Claims Act retaliation claim, not just a generalized fraud claim.  So in a typical case, there will be a claim that... that the whistleblower will... will be able to point to and say I think that this claim is false.  I have a good faith belief that it is false, and then it... and that's what the trigger would be based on.  I mean, in summary, if there's no further questions, I'd like to just summarize.  I think this Court should uphold the plain language of the statute.  While the limitations trigger is unusual, it is the one that Congress set forth in the statute.  It makes sense.  It reflects the unique considerations of encouraging... the goal of encouraging a whistleblower to bring his qui tam claim with his retaliation claim.  19 years of experience have shown that the plain language works in the typical cases that arise, and that none of the reasons given by the petitioners come close to providing a justification for this Court to discard the plain language of the statute.  None of the reasons... this statute does not rise to the level of absurdity that would justify this Court disregarding the plain language.  Thank you.   William H. Rehnquist  Thank you, Mr. Hurt.  Mr. Driemeier, we'll hear from you.       Mr. Chief Justice, and may it please the Court:  Section 3731(b) provides the statute of limitations for, quote, a civil action under section 3730.  There is no question that Ms. Wilson's claim of retaliation is a claim under section 3730.  Petitioner asks the Court to construe section 3731(b) to include an implicit limitation to claims under subsections (a) or (b)--   William H. Rehnquist  Well, apparently Florida didn't think so.     Excuse me, sir?   William H. Rehnquist  Apparently Florida didn't think it was too short.     Well, Florida may have made an alternative policy decision in terms of wanting the claims to be litigated together or apart.  The Congress has established a single uniform statute of limitations which allows the claims to be litigated together, and as I've said, that is in fact the practice that when someone is going to bring a qui tam action, they almost invariably... there... there are 5 exceptions... bring the cases together.  If there are no further questions, thank you very much.   William H. Rehnquist  Thank you, Mr. Driemeier.  Mr. Browning, you have 8 minutes remaining.     INTERRUPTING ",04-169X
0,NO QUESTIONS,04-169X
1,"William H. Rehnquist  Very well, Mr. Hungar.  Mr. Cappuccio, we'll hear from you.     ",04-277X
0,"William H. Rehnquist  Well, can't the Commission change its mind, Mr. Goldstein?   INTERRUPTING William H. Rehnquist  Well, I'm glad I did.  [Laughter]   William H. Rehnquist  But the Congress apparently wanted to go in the direction of deregulation here.   INTERRUPTING ",04-277X
1,"William H. Rehnquist  You say the tort statute means something like the Federal Tort Claims Act.  Does Colorado have something like that?   William H. Rehnquist  Very well, Mr. Eastman.  Mr. Elwood, we'll hear from you.     INTERRUPTING William H. Rehnquist  That's the sort of aggressive sort of thing that the Colorado courts could conclusively decide.   William H. Rehnquist  Yes, it has.  Thank you, Mr. Elwood.  Mr. Reichel, we'll hear from you.     Brian J. Reichel  --At this point in time, I suppose I would disfavor it, because I believe that Bishop versus Wood is controlling.  Your Honors, we respectfully request that this Honorable Court affirm the Tenth Circuit's ruling in this matter.   William H. Rehnquist  Thank you, Mr. Reichel.  Mr. Eastman, you have four minutes remaining.     ",04-278X
0,"William H. Rehnquist  What process do you think your client was entitled to?   William H. Rehnquist  Could that simply be made by the person on the desk?   William H. Rehnquist  Did they simply have to take her word as to the facts on the probable cause issue?   INTERRUPTING William H. Rehnquist  But you said a moment ago, this could be done by the sergeant on duty at the desk who probably had three other calls waiting.  Do you still think that could be done?   William H. Rehnquist  Do you have any other cases besides Logan?   William H. Rehnquist  Yes.   ",04-278X
1,"William H. Rehnquist  And what is a ""document""?  I mean, in Justice Kennedy's example, is it just some handwritten notes?  Do they become ""documents""?   INTERRUPTING William H. Rehnquist  Very well, Ms. Mahoney.  Mr. Dreeben, we'll hear from you.     Michael R. Dreeben  --I don't think that it is that confusing, Justice O'Connor.  This is a statute that was enacted against the backdrop of Section 1503 in a well-understood meaning of the word ""corruptly"".  The same word appears in Section 1505.  When the D.C. Circuit concluded that that provision was vague, as applied to a particular case, Congress came back with a definition that legislatively overruled the D.C. Circuit decision and said ""corruptly"" means ""acting with an improper purpose"".  The ""improper purpose"" in an obstruction-of-justice case has traditionally been ""the purpose to obstruct justice"".  That definition logically applies to Section 1512, because Congress enacted the corruptly-persuades provision to remedy a deficiency in prior law, because it had not included non-coercive, non-deceptive witness-tampering in the statute, originally.  And some courts concluded that it was no longer punishable under Section 1503, either.  To fix that situation, Congress looked to the model of Section 1503 case law, where there had been a variety of acts that are covered that under Petitioner's test would not be, such as secreting a witness, or sequestering a witness, in anticipation of a subpoena so that the witness would be unavailable to testify, or destroying documents before a subpoena had been issued, but in an anticipation that the subpoena was likely.  Those kinds of acts were considered to be unlawful.  Similarly, giving advice, even as a lawyer, to an individual to assert the Fifth Amendment in bad faith, not to protect that individual's own interest, but to obstruct justice by protecting other members of a criminal organization, or, indeed, the lawyer himself, lower courts had recognized could be prosecuted; not uniformly had recognized, but they had uniformly recognized it at the time of the enactment of this statute.  And Congress specifically said,  ""We want 1512 to be able to pick up the kinds of cases that some courts have said are no longer prosecutable under Section 1503, and that had not been included in the original version of 1512. ""  So that there is history here that explains how these terms should be applied.  And as far as Petitioner's contention that the word ""corruptly"" does nothing and leads to a series of horrible hypotheticals, actually a sensitive and appropriate use of the word ""corruptly"" solves those problems.  Petitioners talk about how people should be able to urge each other not to cooperate with a voluntary investigation, that it's part of citizenship to be able to engage in those conversations.  But if an entity has subpoena authority and it doesn't invoke it, and it simply invites people voluntarily to cooperate, it is not going to be an intent to subvert, undermine, or impede that proceeding to invite them to exercise that right.  If the agency wants their testimony, it can get it through compulsion.  Similarly, Petitioners argue that document policies are, per se, made unlawful under the Government's approach.  But as the Court of Appeals specifically recognized in this case, a sound application of the word ""corruptly"" would look to whether there is a threat of some kind of specific proceeding that might trigger an obligation not to destroy the documents before the proceeding gets started.  And, as well, there are intents that are simply not intents to subvert the administration of justice, that may result in rendering certain evidence unavailable.  And if a person engages in that conduct, it may well violate another provision of criminal law, but it doesn't have to violate 1512.  And a sound use of ""corruptly"" prevents all of those hypotheticals from materializing and leading to the conclusion that the statute is unduly broad.  Now, Petitioner in this case, in addition to attacking the word ""corruptly"", also has advanced a number of arguments that there was inadequate instruction on some connection that had to be required between the Defendant's intent in a possible future proceeding.  But the reason that there was no adequate instruction on those issues is largely because Petitioner, itself, deliberately decided to ask for two instructions that were contrary to the statute, and never asked for what it's asked this Court to impose today.  It never asked that the Defendant must be shown to believe that some particular proceeding was likely to occur in the near future.  Instead, what it did is say that the Defendant had to have an intent to impair an object's availability for use in a particular proceeding.  And what the Court of Appeals said is that if there was any problem in that, it's not reversible error; it's harmless, because everybody knew that the proceeding that was anticipated was an SEC investigation of Enron.  And the other instruction that Petitioners asked for in the District Court is that the official proceeding must be ongoing or scheduled to be commenced in the future.  But that instruction is flatly contrary to the statute.   William H. Rehnquist  Thank you, Mr. Dreeben.  Ms. Mahoney, you have four minutes remaining.     INTERRUPTING ",04-368X
0,"William H. Rehnquist  But you could undermine and be unsuccessful.  It's not as though undermine means that you're necessarily going to succeed.   INTERRUPTING William H. Rehnquist  So that big, heavy guy would violate the statute just by standing there?   INTERRUPTING ",04-368X
1,"William H. Rehnquist  Mr.... General Petro, I for one would like to hear what you have to say about the question presented in your petition for certiorari.   INTERRUPTING William H. Rehnquist  Thank you, General Petro.  Ms. Maynard, we'll hear from you.   ",04-495X
0,"William H. Rehnquist  Well, could you answer my question first?  What kind of notice, if any, did Mr. Austin get?   William H. Rehnquist  You mean a trial before all the... before they were about to be committed or the hearing at which it was determined whether they would be or not?   INTERRUPTING William H. Rehnquist  Well, what's... what's wrong with that?   INTERRUPTING William H. Rehnquist  I mean, if he can... if he's not a gang leader, he can tell them why he isn't.   William H. Rehnquist  You... you want a trial-type proceeding.   William H. Rehnquist  Is this happening under the new policy?   William H. Rehnquist  But now, you just were going to say here's what was happening.  Do you mean under the new policy?   William H. Rehnquist  Well, why... why is that the question?  If the new policy meets constitutional standards, why does it have to fix something else?   INTERRUPTING William H. Rehnquist  Well, why does the Due Process Clause require reasons?   INTERRUPTING William H. Rehnquist  That... that was a statute.   INTERRUPTING William H. Rehnquist  Well, what's wrong with giving him the opportunity to say why he's not a gang leader?   William H. Rehnquist  But how can you know whether the problems are ongoing if the new rules haven't been implemented?   William H. Rehnquist  Why... why isn't it a question of as facially in the abstract is it okay?   INTERRUPTING William H. Rehnquist  Where do... where do we find those findings?  Where in the record do we find the findings about individual people?   ",04-495X
1,"William H. Rehnquist  Did the court give any explanatory reason for what it did?   William H. Rehnquist  But a single judge doesn't have the authority, does he?   William H. Rehnquist  Well, how many cases very similar to that... this exists?  It struck me as just procedurally bizarre.   William H. Rehnquist  Very well, Ms. Smith.  Mr. Shors.     Matthew M. Shors  Thank you, Mr. Chief Justice.   William H. Rehnquist  Ms. Smith.     ",04-514X
0,"William H. Rehnquist  For how long after the judgment becomes final can a court engage in sua sponte consideration of whether to grant a rehearing?   INTERRUPTING William H. Rehnquist  Shouldn't the State at least be notified of the pendency of this sort of thing?   William H. Rehnquist  Well, now, that... that really doesn't add up.   INTERRUPTING William H. Rehnquist  That might be a clerical error all by itself.   William H. Rehnquist  But there was no doubt that there was a final judgment here in the death sentence.   INTERRUPTING William H. Rehnquist  This was... this was how long after cert had been denied?   William H. Rehnquist  Well, to say there's no surprise to the State, that may be the State probably knew as much as the defendant about what was in the record, but certainly it was a surprise to the State to know that the court of appeals, after cert was denied, was pondering all this for that long a time.   INTERRUPTING William H. Rehnquist  So the counsel should go to the... see the docket sheet regularly to see whether the court of appeals might be doing something?   INTERRUPTING William H. Rehnquist  And you say the State should have known what the court of appeals... before cert was ever considered because it was on a docket sheet.  But the case was over, so far as the parties were concerned, in the court of appeals and in the district court.   William H. Rehnquist  What if the court of appeals were talking about a point of law and the court of appeals issued an opinion saying we agree with three circuits and disagree with four others?  The losing party brings it here and we deny certiorari.  It goes back.  And then one of the judges on the panel says, gee, I think we should have gone with the other circuits.  Can they do that at that point?   INTERRUPTING William H. Rehnquist  But that's an intervening circumstance.  It's not a single judge changing his mind.   INTERRUPTING William H. Rehnquist  What was the... what court had granted the stay?   William H. Rehnquist  And it remained in effect all that time?   ",04-514X
