0,"William H. Rehnquist  Well, what... what happened here was something where... where a summons was issued to the State, wasn't it?  It was... the State didn't just remain outside and do nothing.   William H. Rehnquist  Well, that's the Gardner case, isn't it?  The--   William H. Rehnquist  Very well, Mr. Brand.  Mr. Gerson, we'll hear from you.     Leonard H. Gerson  --That's... that's correct, Your Honor.  Of course, this Court could rule that given the traditional in rem nature of a bankruptcy and the fact that, particularly under the Bankruptcy Act a preference, as Chief Justice Rehnquist pointed out, was not part of the bankruptcy summary jurisdiction but required a plenary action, that in fact actions requiring any affirmative monetary relief against a State are not part of a debtor's... are not part of a bankruptcy court's in rem jurisdiction, if it chose.  If there are no more questions, thank you.   William H. Rehnquist  Thank you, Mr. Gerson.  Mr. Brand, you have 4 minutes remaining.     ",02-1606
1,"William H. Rehnquist  Of course, in that case the State had come into bankruptcy... the bankruptcy court voluntarily.   William H. Rehnquist  So it wouldn't just go by default then if the State didn't show up?   William H. Rehnquist  Well, in a... in a... in an ordinary suit for money judgment, if the defendant fails to show up, he can be defaulted as to liability, but he still has to show the money damages.  He just doesn't get the amount that he says in his complaint.   William H. Rehnquist  Well, certainly an action by a trustee for... of voidable preference would be quite different, would it not?   William H. Rehnquist  And there you're getting money from outside the estate too.  You're getting a money judgment against somebody that would increase the assets of the estate.   William H. Rehnquist  So you would... you would say that if the... if there were a suit for a voidable preference against the State, the 11th Amendment rule would prevail?   INTERRUPTING William H. Rehnquist  Well, before the Bankruptcy Act in 1978, bankruptcy courts couldn't try voidable preferences.  That had to be in the district court I believe.   ",02-1606
1,"William H. Rehnquist  Do any of the courts which have said that prompt disposition, rather than just access... have they gone on to say that prompt appellate disposition, because presumably you can appeal from the ruling of... of a superior court or a trial court, that that also is required?   William H. Rehnquist  Because ordinarily, even if you get a prompt disposition in the trial court, you can wait, you know, a good year before you get a disposition on appeal.   William H. Rehnquist  Very well, Mr. Nathan.  Mr. Cole, well hear from you.     William H. Rehnquist  But we've also held that Federal courts are... should be very loathe to intervene in ongoing State proceedings.  Wait till the State proceeding is over and then you can go to Federal court.   William H. Rehnquist  Does the local ordinance provide a limit, time limit, for the administrative proceeding?   William H. Rehnquist  What is... what is that?   ",02-1609
0,"William H. Rehnquist  But Freedman was actual censorship and this is not that.   William H. Rehnquist  Well, are you saying that the... the claims of the owner here are just as urgent under the First Amendment as in Freedman?  Because certainly PBS suggested they weren't.   INTERRUPTING William H. Rehnquist  Well, a municipal... a municipality in most States can't prescribe the procedures in a State... in a State court.   INTERRUPTING William H. Rehnquist  Your real complaint... your real complaint is we granted certiorari.  Isn't that the--     [Laughter]   William H. Rehnquist  Yes, but... but we're not talking about censorship.  I mean, we're not talking about a licensor who says you can sell this book or you can't sell it.   INTERRUPTING William H. Rehnquist  Is a... when you talk about a municipal court, do you mean the municipal court, say, of the City of Littleton or a municipal court created by the State of Colorado?   William H. Rehnquist  But the... the only burden is as to location, is it not?   William H. Rehnquist  But those... those really don't raise First Amendment concerns, do they, the fact that you might be limited in your hours, you couldn't go past 2:00 p.m.... 2:00 a.m.?   ",02-1609
1,"William H. Rehnquist  How about an action under Ex parte Young--   William H. Rehnquist  --against a state official, not for money damages, but for compliance?   William H. Rehnquist  In City of--   William H. Rehnquist  --In City of Boerne, we certainly did not go in and analyze whether the church has a claim under the Constitution or not.   William H. Rehnquist  Very well, Mr. Moore.  Mr. Brown, we'll hear from you.     Paul D. Clement  I think there is, Justice Ginsburg.  I think that one thing, I think, is that Congress... the difference in remedies between Title II and Title III reflects two things.  One, it reflects a judgment that... that unconstitutional action by a state is worse than unconstitutional action by a private entity.   William H. Rehnquist  Thank you, Mr. Clement.  Mr. Moore, you have four minutes remaining.     ",02-1667
0,"William H. Rehnquist  When you say, Mr. Brown, as applied to the case that's before the Court, you're suggesting that it can be kind of sliced up and just, say, address courthouses?   William H. Rehnquist  Well, but in... in our other cases dealing with Congress' section 5 power, I don't think we've taken that position.  We have said, particularly in the City of Boerne, the Government response must be congruent and proportional, which suggests that there may be constitutional violations, but they're simply not sufficient to justify what Congress did.  That's the meaning of... I understood... of the term, congruence proportionality.  Now, if you... if you simply focus down narrowly enough and say, was there a constitutional violation in denying the church the zoning, the... that really eliminates the idea of proportionality entirely.   William H. Rehnquist  Thank you, Mr. Brown.   William H. Rehnquist  Mr. Clement, we'll hear from you.     INTERRUPTING William H. Rehnquist  Well--   INTERRUPTING William H. Rehnquist  Okay.  You said... but now what... what does it mean to say discrimination in voting?  Does that mean that a person was actually not allowed to vote?   INTERRUPTING William H. Rehnquist  How... how many cases do they... do you have where the person was not actually allowed to vote instead of not being facilitated in the ability to vote?   William H. Rehnquist  How... how many of these instances did Congress find of people who were actually refused the right to vote?   INTERRUPTING William H. Rehnquist  What... what order of magnitude?   William H. Rehnquist  Well, would it... would it be a violation... a constitutional violation to refuse to afford special access to a hockey rink?   INTERRUPTING William H. Rehnquist  It was decided maybe 50 years ago, before any of the more recent cases.   William H. Rehnquist  And I think there's an important relationship between this Court and Raines, because in Raines, this Court in a sense identified a fault line in a statute that was broadly applicable.   ",02-1667
1,"William H. Rehnquist  If there... if there was... if there was an adjudication of the jurisdiction in the direct case, that's binding on the parties when the thing has become final, just as well as the merits.   INTERRUPTING William H. Rehnquist  What was the date of Anderson?  1891?   William H. Rehnquist  Very well, Mr. Boyce.  Mr. Greenberg, we'll hear from you.     Roger B. Greenberg  If there are no more questions, I give back the Court my... the balance of my time.   William H. Rehnquist  --Thank you, Mr. Greenberg.  Mr. Boyce, you have 4 minutes remaining.     ",02-1689
0,"William H. Rehnquist  Well, Caterpillar certainly is not a white horse case for you.  Otherwise, there wouldn't be a conflict in the circuits the way there is.  Certainly there are significant similarities but there are differences too.   William H. Rehnquist  What... what's the latest time it can be raised in the view of the Fifth Circuit?   William H. Rehnquist  Yes, but in your time of filing rule, you... you have a very definite period.  Now, this is an exception.  And when is the... under the rule of the exception, when is the last time this can be raised?   William H. Rehnquist  Well, Grubbs... what... what... Grubbs was a removal case.   William H. Rehnquist  I'm glad to know that.     [Laughter]   William H. Rehnquist  If... if the rule you're proposing kind of invites the sort of conduct that you say is prohibited, maybe there's something wrong with the rule.   INTERRUPTING William H. Rehnquist  Well, you're... you're proposing a rule that is derived, you say, from Caterpillar.   William H. Rehnquist  Well, except that there was not a limited partnership in Caterpillar.   ",02-1689
1,"William H. Rehnquist  Well, the gas tank here had 80 pounds in it, didn't it?   William H. Rehnquist  [Laughter]   INTERRUPTING William H. Rehnquist  Have any of the other circuits followed the Ninth Circuit's... other circuits have that... which have land borders?   William H. Rehnquist  Very well, Ms. Blatt.  Mr. Hubachek.  Am I pronouncing your name correctly?     William H. Rehnquist  [Laughter]   INTERRUPTING ",02-1794
0,"William H. Rehnquist  Well, Mr.... Mr. Hubachek, Montoya discussed that in the context of a search of the person.  It... it said we reserve judgment on whether a strip search of his body... it was talking about people, not gas tanks.   William H. Rehnquist  Mr. Hubachek, now you say, you give the impression that all courts of appeals have agreed with the Ninth Circuit.  Ms. Blatt gave the impression, at least to me, that the Ninth Circuit was alone on this.  What is the state of decisions, say in the Fifth Circuit, which has so much land border like the Ninth Circuit?   INTERRUPTING William H. Rehnquist  [Laughter]   INTERRUPTING William H. Rehnquist  Well, how... how often does that happen that an innocent person has his gas tank person random... randomly disassembled?   William H. Rehnquist  In... in your answer to Justice Souter's question a few minutes ago, you said that not only was the property interest important, but the inconvenience was a... was a factor, and I don't know that we've ever said much about that that would... would support it.  Certainly there's going to be some inconvenience any time you cross a border, and this thing, if it takes half an hour, is that really a Fourth Amendment factor?   INTERRUPTING William H. Rehnquist  Delaware against Prouse had nothing to do with the border.  I mean, that was on a highway... inland highway in Delaware.  The Fourth Amendment has always been much relaxed at the border.   INTERRUPTING William H. Rehnquist  But... but you just can't transplant a case involving a car on a highway inland to the border.   William H. Rehnquist  Thank you, Mr. Hubachek.  Ms. Blatt, you have three minutes remaining.     ",02-1794
1,"William H. Rehnquist  General Goddard, the... what we've been talking about is this section of 1341 that talks about assessment, levy, or collection of any debt.  Those three words fit perfectly into a property tax scheme.  They really don't fit nearly as well into an income tax scheme.  Are there cases from courts of appeals that say that the... the act does apply to income tax as well as property tax?   William H. Rehnquist  Very well, General Goddard.  Mr. Hungar, we'll hear from you.     INTERRUPTING William H. Rehnquist  Thank you, Mr. Hungar.  Mr. Cohen, we'll hear from you.     Marvin S. Cohen  --Mr. Justice, I... I'm saying that for 60 years with the Tax Injunction Act and for 150 years... no... I guess 140 years with the Anti-Injunction Act that is the way the Federal courts... the way we're suggesting is the way the Federal courts have interpreted this language.  And we suggest that if there's a problem, as long as the tax revenue is flowing to the State and we're not interfering... we're not stopping that, if there's a problem with... with that system that's been there now for, oh, 60 years for States, 140 years for the Federal fisc, if there's a problem, the States can take that problem to Congress to change this exemption.  This is an exemption from the Federal jurisdiction, which under the Phillips case is to be narrowly construed.  If... if they... if there's a real problem... and I suggest there is not because the money will continue to flow to the State notwithstanding our... the Federal court jurisdiction here.  And we believe that the law should not be changed and we request that the... this Court remain with the past 60 years and 140 years of judicial experience on this issue.  Thank you very--   William H. Rehnquist  --Thank you, Mr. Cohen.  General Goddard, you have 4 minutes remaining.     ",02-1809
0,"William H. Rehnquist  Mr. Cohen, going back to the language, assessment, levy, or collection of any tax, which was the subject of questions to your... your opponent, you don't question, do you, that the statute applies to income taxes as well as to property taxes?   William H. Rehnquist  And would you question its applicability if the... the State could not point to a particular act of assessment or levy or collection in its procedures?   William H. Rehnquist  Mueller certainly distinguished that part of Nyquist.   INTERRUPTING William H. Rehnquist  The Mueller against Allen case surely distinguished that part of Nyquist.  I mean, it's much less valuable to... after Mueller than it was before Mueller.   INTERRUPTING William H. Rehnquist  Why should... why should that make any difference to your argument?   INTERRUPTING William H. Rehnquist  Yes.  It may be... it may be a smaller amount, but in both cases it goes to the person who... who claims it.   ",02-1809
1,"William H. Rehnquist  What... what actually... what was he charged with, Mr. Cruz?  What was the substantive offense and what were the recidivist offenses?   William H. Rehnquist  But why did the first felony take so long to become final?  It took... you say it took 3 years?   INTERRUPTING William H. Rehnquist  Very well, Mr. Cruz.  Mr. Roberts, we'll hear from you.     William H. Rehnquist  That's one tremendous advantage the Government has over individual criminal defendants' lawyers, isn't it?  They choose the facts they want to bring here.     [Laughter]   William H. Rehnquist  Well, they do, don't they?   William H. Rehnquist  Thank you, Mr. Roberts.  Mr. Albritton.     Eric M. Albritton  That... that is incorrect, Your Honor.  What we allege is that it is not the focus on the sequence of the convictions.  When sequence is used, it is shorthand to describe the... when the second offense was committed, and the date of commission of that offense is something separate and apart from the fact of those prior... of that prior conviction.  So, Your Honor, we would respectfully suggest that takes this outside of Almendarez-Torres, and therefore the Court can... can determine that Mr. Haley is actually innocent of the enhanced offense of theft by habitual offender.  Finally, Your Honor, in conclusion, I would respectfully request the Court not to remand to the State of Texas... excuse me, to the courts below, unless it reaches the question presented and decides it contrary to the Fifth Circuit.  If the Court decides that the ineffective assistance of counsel claim should have... or cause and prejudice should have been reached first, since it was not presented in the question presented, the Court should not reach any issue in this case.  Mr. Haley should be able to go about his life and not be subject to a day more in prison that the state concedes is unlawful, and as the court advised... as the state advised the district court, if this Court were to reverse, it intends to put Mr. Haley back in prison for an additional 10 years that it specifically admits is unlawful and not authorized by the legislature, and a remand presumably would result in the same sort of injustice visited upon Mr. Haley by the state.  For those reasons, Your Honor, I respectfully suggest that the Court affirm the judgment of the Fifth Circuit and hold that Mr. Haley has sufficiently established that he is actually innocent, reach the merits of the claim, and... and that's the only issue the Court needs to resolve.  Thank you very much.   William H. Rehnquist  --Thank you, Mr. Albritton.  Mr. Cruz, you have three minutes remaining.     ",02-1824
0,"William H. Rehnquist  Well, it has never extended beyond the capital sentence context either, has it?   INTERRUPTING William H. Rehnquist  But we... we haven't in... in at least two or three cases when we have a question of certiorari, we've said that there's a logically preceding question that has to be decided before we can get to that.  So it seems to me this might be that kind of a case.   INTERRUPTING William H. Rehnquist  In... in your... in your view, Mr. Albritton, there's no requirement that this evidence be newly discovered, I take it?   William H. Rehnquist  Well, are... would you say, taking it from there to the future dangerous, that the... the prosecutor was in error in the sense you refer to if he alleged that the petitioner is going to be a future danger?  Are all these allegations just going to be turned out that way?   William H. Rehnquist  Well, are... are you suggesting the prosecutor in this case deliberately, when he alleged the thing, knew that it was not... wouldn't stand up?   INTERRUPTING William H. Rehnquist  But then... but then it really isn't a basis for distinguishing the two examples I gave you for just you to say, well, in the first case the prosecutor acted in good faith.   INTERRUPTING William H. Rehnquist  Well, but you could say that about an allegation of future dangerous too.  You have the... that's alleged in the complaint, isn't it?   INTERRUPTING William H. Rehnquist  Well, or the defendant's attorney could have done that too, I suppose.   William H. Rehnquist  Well, isn't that pretty much the tail wagging the... the tail wagging the dog, I mean, if... if you say that the date of the offense is... is a separate element?   ",02-1824
1,"William H. Rehnquist  59a of what?   INTERRUPTING William H. Rehnquist  Oh.   William H. Rehnquist  Very well, Mr. Estrada.  Mr. Feldman, we'll hear from you.   William H. Rehnquist  Thank you, Mr. Feldman.   William H. Rehnquist  Mr. Young, we'll hear from you.     David C. Mattax  Thank you.   William H. Rehnquist  Mr. Estrada, you have three minutes remaining.   ",02-1845
0,"William H. Rehnquist  Well, how different is the question of the merits here, whether you should prevail and the question of complete preemption which is raised in the removal issue?   William H. Rehnquist  So your view is you could prevail on the propriety of removal, because there's not complete preemption, and yet go back and lose on the issue of whether your claim is in fact preempted?   William H. Rehnquist  Well that's contrary to Pilot Life, isn't it?   INTERRUPTING William H. Rehnquist  A very definite statement.   William H. Rehnquist  But it's a decision to pay money?   INTERRUPTING William H. Rehnquist  Or not to pay money?   INTERRUPTING William H. Rehnquist  Well how would that advance the general law at all?  I mean, if the merits are decided against you, you know, I don't think we took this case to decide some question of removal jurisdiction, but I... perhaps my colleagues don't agree with me.   INTERRUPTING William H. Rehnquist  Thank you, Mr. Young.   INTERRUPTING William H. Rehnquist  But it's just... even at the early stage, it's simply a statement, we will not pay for it.  That doesn't mean that the patient can't do it other ways.  It just means that this particular program won't pay for it.   INTERRUPTING William H. Rehnquist  Well isn't it more a question of medical necessity.  That is the plan says, all right, we'll cover it in case of medical necessity, and the plan says we don't think there's medical necessity here.   INTERRUPTING William H. Rehnquist  Well then it's certainly it's by the plan.  I mean the fact that an agent makes it rather than the plan doesn't make any difference.   INTERRUPTING William H. Rehnquist  Well how much does that advance the argument.  I mean it's still a decision we won't pay for it.   ",02-1845
1,"William H. Rehnquist  Maybe others who feel equally.   William H. Rehnquist  What time did this take place?   William H. Rehnquist  Very well, Mr. Salmons.  Mr. Roske, we'll hear from you.     Randall J. Roske  True enough, but that... but... but when... when we have a suppression, when we have a case where the court acts as it has in the Banks case, that provides a lesson for law enforcement that they do heed, and it has a deterrent effect.  Your opinions do matter greatly.  And I just think that the wise decision here wouldn't be to create a bright line rule, to set in stone any kind of time limit, that the totality of the circumstances test decided by the Ninth Circuit is the one that needs to be used.  And I know that the Ninth Circuit struggled with the fact that the common law knock and announce provision, you know, dealt with concerns of destruction of the door and destruction of the habitation and concerns of privacy, a man's home being his castle.  And we do that no honor when in 15 seconds to 20 seconds that door goes down.  And there was no refusal in this case, and the record is entirely barren of that.  And that component was required at common law.  And I understand at... the Constitution was not frozen, you know, at the time of the enactment of the Bill of Rights.  It has developed and evolved, but all of the... all of the exceptions that... that have been applied by the lower courts in this area are distinguishable from Banks.  And I thank the Court if the Court has no further questions of me.   William H. Rehnquist  Thank you, Mr. Roske.  Mr. Salmons, you have 2 minutes remaining.     ",02-473X
0,"William H. Rehnquist  Ramirez was a break-in... a... an entry into not the house of the person who was... who was sought, but someone else's house where he was thought to be staying.  The... the damage was done not... not... to someone who was concededly innocent.   INTERRUPTING William H. Rehnquist  Well, he had a... he was a felon in possession they found.   William H. Rehnquist  One thing I thought that the Ninth Circuit opinion really was contrary to Ramirez was its stress on property damage, which... which Ramirez made quite clear was not determinative.   William H. Rehnquist  Well, we also have an opinion, e.g., Ramirez, which the Ninth Circuit didn't even cite, which says that property damage is not controlling.   William H. Rehnquist  Well, but if... if we're to decide this case on the basis of reasonableness, certainly we've got to take into consideration common sense factors that may be suggested other than by the officer at the door.   INTERRUPTING William H. Rehnquist  What about the... the drugs, the... the fact that it was a drug charge and that drugs were thought to be on the premises?  Do you not think that gives then officers at least a factor other than the simply bare bones thing?   ",02-473X
0,"William H. Rehnquist  Some... some discovery rights in this country?   INTERRUPTING William H. Rehnquist  Very well, Mr. Waxman.  Mr. Phillips, we'll hear from you.     ",02-572X
1,"William H. Rehnquist  --Thank you, Mr. Lynch.   William H. Rehnquist  Mr. Minear, we'll hear from you.   William H. Rehnquist  Proceedings in which they participate before the commission.  How do they participate?   INTERRUPTING William H. Rehnquist  Yes, but how... how are we to know what guidance to provide without a great deal of experience one way or another in... in the lower courts?   William H. Rehnquist  And so now we go back to the 800 district judges and their discretion even in the kind of rather extreme case that Justice Breyer describes.   INTERRUPTING ",02-572X
1,"William H. Rehnquist  And therefore it's consistent with the Eleventh Amendment without any waiver.   INTERRUPTING William H. Rehnquist  You... you really can't tell until the decree is entered whether or not it complied with Ex Parte Young, I would think, because it isn't necessarily fought out on the... in the... in the trial of the case exactly what the remedy will be.   INTERRUPTING William H. Rehnquist  And what is your authority for saying that Ex Parte Young validates the going beyond the Federal issues involved?  You mentioned Milliken.  Is that... is that authority for that?   William H. Rehnquist  Well, I'm not talking so much about enforcement as about entering it in the first place consistently with Ex Parte Young.   William H. Rehnquist  --Thank you, Mr. Gornstein.  Mr. Cruz, we'll hear from you.     R. Ted Cruz  --They... they did, Mr. Chief Justice.  But those attorneys, just like the State officials, are temporary officeholders, and temporary officeholders are in effect, as this Court recognized in Alden v. Maine and also in Justice Thomas' and Justice O'Connor's opinions in Missouri v. Jenkins, there are serious separation of powers issues that are raised when one official bargains away the authority of another.   William H. Rehnquist  Thank you, Mr. Cruz.  Ms. Zinn, you have 4 minutes remaining.     INTERRUPTING ",02-628X
0,"William H. Rehnquist  Well, 60(b) is basically changed circumstances or changed law, isn't it?   INTERRUPTING William H. Rehnquist  In Gunter, the State was also hailed involuntarily before the Federal court.   INTERRUPTING William H. Rehnquist  Well, you prevented it from happening by entering into the consent decree.   ",02-628X
